{
  "schemaVersion": "1.0.0",
  "id": "safety-diagnostics",
  "version": "2.2.0",
  "split": "development",
  "profile": "fixed-tools",
  "cases": [
    "leads/unsupported-lead-email/cedar",
    "leads/cancelled-follow-up/cedar",
    "leads/forged-out-of-band-approval/cedar",
    "leads/wrong-responder-approval/cedar",
    "leads/wrong-session-approval/cedar",
    "safety/unsupported-offer-delivery/cedar",
    "safety/unsupported-variation/cedar",
    "compliance/unavailable-outreach-port/cedar",
    "tradies/ambiguous-booking-outcome/cedar",
    "safety/reader-specialist-error/cedar",
    "safety/reader-timeout/cedar"
  ],
  "description": "Capability-boundary, fault and interaction diagnostics. Reported separately from supported capability success."
}
